Keyword,Volume,Keyword Difficulty
skapa cv,1000,39
skapa cv gratis,590,35
cv skapare,260,40
skapa cv gratis mall,210,
skapa cv online gratis,170,36
skapa ett cv,170,37
skapa gratis cv,90,36
skapa cv mall,70,36
skapa cv online,40,
skapa cv linkedin,30,22
skapa ditt cv,30,
skapa ett cv gratis,30,34
cv skapa,20,
skapa cv arbetsförmedlingen,20,
skapa cv från linkedin,20,
skapa cv gratis online,20,
skapa cv i mobilen,20,
skapa cv i word,20,
skapa cv mall gratis,20,
skapa cv och personligt brev,20,
skapa cv pdf,20,
skapa en cv,20,
skapa ett cv online,20,
hur skapar man ett cv,10,
skapa cv på nätet,10,
adobe skapa cv,0,
arbetsförmedlingen skapa cv,0,
att skapa ett cv,0,
bra program att skapa cv i,0,
cv skapare online,0,
cv skapare online gratis,0,
cv skaparna,0,
cv skaparna företag,0,
europass skapa cv,0,
google calendar skapa cv,0,
gratis skapa cv,0,
http khaleddns.strikingly.com skapa cv,0,
hur kan man skapa ett cv,0,
hur man skapa cv,0,
hur skapar man cv till arbetsförmedligen,0,
hur skapar man cv till arbetsförmedlingen,0,
illustrator eller indesign till skapa cv,0,
lärarpartner skapa fullständigt cv,0,
lättast att använda illustrator eller indesign till skapa cv,0,
program för att skapa cv,0,
program för att skapa cv i,0,
skapa cv fil,0,
skapa cv från linked in,0,
skapa cv genom arbetsförmedling,0,
skapa cv gratis efter gymnasiet,0,
skapa cv hur,0,
skapa cv i canva,0,
skapa cv i indesign,0,
skapa cv i pdf format,0,
skapa cv i photoshop,0,
skapa cv in design,0,
skapa cv indesign,0,
skapa cv mall snyggt,0,
skapa cv med sketch,0,
skapa cv p n'tet,0,
skapa cv program,0,
skapa cv på engelska,0,
skapa cv på word,0,
skapa cv sjukvård,0,
skapa cv utifrån mall illustrator,0,
skapa cv via linkedin,0,
skapa cv word,0,
skapa digitalt cv,0,
skapa din egna cv,0,
skapa din egna cv mall,0,
skapa ditt cv online,0,
skapa eget cv,0,
skapa en bra cv,0,
skapa en kreativ cv till word,0,
skapa en video cv,0,
skapa ett bra cv,0,
skapa ett cv för konsult,0,
skapa ett cv i illustrator,0,
skapa ett cv i word,0,
skapa ett cv i word utan textrutor,0,
skapa ett cv online online gratis,0,
skapa ett cv som står ut,0,
skapa ett kreativt cv,0,
skapa ett professionellt cv,0,
skapa ett professionellt cv engelska,0,
skapa ett starkt cv från grunden,0,
skapa header till cv,0,
skapa kontakter cv,0,
skapa nytt cv,0,
skapa och ladda ner gratis cv och pb,0,
skapa perfekt cv,0,
skapa portabelt cv,0,
skapa rubrik cv,0,
skapa snyggt cv,0,
skapa visuellt cv,0,
skapade nytt cv på engelska,0,
telge skapa cv,0,
verktyg skapa cv,0,
vilket program använder man för att skapa ett cv,0,
vilket program kan jag skapa ett cv,0,
visma recruit skapa cv,0,
word online skapa cv,0,
word skapa cv,0,
